{
  "$schema": "./schema/uxpin-ariada.config.schema.json",
  "exportDir": "./fixtures/uxpin-export",
  "outputDir": "./scan-evidence/ariada-output",
  "browser": "chromium",
  "format": "both",
  "severityThreshold": "serious",
  "timeoutMs": 30000,
  "domains": ["accessibility", "security", "privacy", "sustainability", "structured-data", "ai-readiness"]
}
